{
  "$schema":"https://json-schema.org/draft/2020-12/schema","$id":"content-production-image-manifest-v1","type":"object","additionalProperties":true,
  "required":["schemaVersion","manifestVersion","manifestId","runId","strainId","revision","attempt","sourceStockPath","sourceStockBlobSha","visualPreparationHash","generatedFromManifestVersion","promptSnapshot","evidenceSnapshot","visualMetadataSnapshot","expectedInboxFilename","expectedPrimaryPath","generatedAt","approvalStatus","approvedAt","approvalType","approvedManifestRevision","approvedAttempt","approvedSourceSha256","imageInboxCommit","imageProcessingCommit","processedPrimaryBlobSha","processedPrimarySha256","width","height","audit"],
  "properties":{"schemaVersion":{"const":1},"manifestVersion":{"const":1},"manifestId":{"type":"string"},"runId":{"type":"string"},"strainId":{"type":"string"},"revision":{"type":"integer","minimum":1},"attempt":{"type":"integer","minimum":1},"sourceStockPath":{"type":["string","null"]},"sourceStockBlobSha":{"type":["string","null"]},"visualPreparationHash":{"type":"string"},"generatedFromManifestVersion":{"type":["integer","null"]},"promptSnapshot":{},"evidenceSnapshot":{},"visualMetadataSnapshot":{"type":"object","required":["alt","rights","scope","aiGenerated","sourceType"]},"expectedInboxFilename":{"type":"string"},"expectedPrimaryPath":{"type":"string"},"generatedAt":{"type":["string","null"]},"approvalStatus":{"enum":["pending","approved","rejected"]},"approvedAt":{"type":["string","null"]},"approvalType":{"type":["string","null"]},"approvedManifestRevision":{"type":["integer","null"]},"approvedAttempt":{"type":["integer","null"]},"approvedSourceSha256":{"type":["string","null"]},"imageInboxCommit":{"type":["string","null"]},"imageProcessingCommit":{"type":["string","null"]},"processedPrimaryBlobSha":{"type":["string","null"]},"processedPrimarySha256":{"type":["string","null"]},"width":{"type":["integer","null"]},"height":{"type":["integer","null"]},"audit":{"type":"array"}}
}
