{
  "schemaVersion": 1,
  "manifestVersion": 1,
  "manifestId": "content-production-start-32245177161-shiva-skunk-image",
  "runId": "content-production-start-32245177161",
  "strainId": "shiva-skunk",
  "revision": 1,
  "attempt": 1,
  "sourceStockPath": "stock/items/shiva-skunk.json",
  "sourceStockBlobSha": "5fcd2e28d1ab8538c17248e167dbc4a930d4f13b",
  "visualPreparationHash": "4962da60ada2b2c94e97faeb6bdffe9da35289c5cafe61ae1ff2bcea1ac0af44",
  "generatedFromManifestVersion": null,
  "promptSnapshot": "TEXT-EVIDENCE FALLBACK: the breeder-operated product page contains cultivar-specific image slots, but the retrievable visual representation in this run was insufficient for trustworthy image-derived morphology extraction. Use the breeder's written growth-pattern evidence only; do not treat it as image-derived evidence.\nCULTIVAR IDENTITY CONTEXT: Shiva Skunk by Sensi Seeds; Northern Lights #5 × Skunk #1; mostly-indica feminized cultivar.\nTEXT MORPHOLOGY EVIDENCE: the official page describes a compact plant around 110-120 cm with many branches and dense, heavy, extremely resinous flowers that swell during flowering.\nPHOTOGRAPHIC CONSTRAINTS: photorealistic botanical reference photography; single mature female cannabis plant; complete plant visible; natural light; neutral non-distracting background; no text; no collage; no packaging; no smoke.\nNEGATIVE CONSTRAINTS: no fruit or berries; no people; no labels or logos; no jars, bags, boxes or bottles; no smoke; no unrelated objects; no fantasy anatomy; do not add cultivar-specific morphology beyond the cited text evidence.",
  "evidenceSnapshot": [
    {
      "description": "[EVIDENCE_ALIGNMENT=NOT_APPLICABLE] Official visual reference is present on the breeder-operated page but was insufficient for reliable image-derived morphology extraction in this run; all non-alignment AI visual QA gates remain required.",
      "sourceIds": [
        "sensi-seeds-shiva-skunk"
      ]
    },
    {
      "description": "Sensi Seeds text describes a compact plant with many branches and dense, heavy, extremely resinous flowers; the buds swell as flowering advances.",
      "sourceIds": [
        "sensi-seeds-shiva-skunk"
      ]
    }
  ],
  "visualMetadataSnapshot": {
    "alt": "Shiva Skunkの公式テキスト形態情報を基礎に、未確認の画像由来形態を付加せず作成するAI生成参考ビジュアル",
    "rights": "AI-generated project asset for Cannabis Strain Wisdom. No official or third-party image is copied or stored; fallback uses official text evidence only.",
    "scope": "cultivar",
    "aiGenerated": true,
    "sourceType": "aiGenerated"
  },
  "expectedInboxFilename": "shiva-skunk.jpg",
  "expectedPrimaryPath": "strains/shiva-skunk/images/generated/primary.webp",
  "generatedAt": null,
  "approvalStatus": "pending",
  "approvedAt": null,
  "approvalType": "human-visual-review",
  "approvedManifestRevision": null,
  "approvedAttempt": null,
  "approvedSourceSha256": null,
  "imageInboxCommit": null,
  "imageProcessingCommit": null,
  "processedPrimaryBlobSha": null,
  "processedPrimarySha256": null,
  "width": null,
  "height": null,
  "audit": [
    {
      "severity": "INFO",
      "code": "MANIFEST_CREATED",
      "at": "2026-08-19T10:57:28Z",
      "productionPhase": "IMAGE_PENDING",
      "note": "Created by PRODUCTION START V1. Candidate output is review-only and cannot publish."
    }
  ]
}
