{
  "schemaVersion": 1,
  "manifestVersion": 1,
  "manifestId": "content-production-start-32255989337-golden-tiger-image",
  "runId": "content-production-start-32255989337",
  "strainId": "golden-tiger",
  "revision": 1,
  "attempt": 1,
  "sourceStockPath": "stock/items/golden-tiger.json",
  "sourceStockBlobSha": "148a4c34e943b65c57a265bc216316031ea37d82",
  "visualPreparationHash": "4d3c028617d5e65711bc0856f6f14dcc0b3d80941fdc08f00a888ffe77e87e54",
  "generatedFromManifestVersion": null,
  "promptSnapshot": "TEXT-EVIDENCE FALLBACK: the breeder-operated cultivar page exposes cultivar-specific imagery, but the visual pixels were not retrievable in this run in a form sufficient for trustworthy image-derived morphology extraction. Use only the official text morphology evidence below; evidence alignment is NOT_APPLICABLE.\nCULTIVAR IDENTITY CONTEXT: Golden Tiger by ACE Seeds; Old Malawi Killer × Koh Chang Thai × Hmong Thai × 3rd-generation Malawi male; semi-stabilized 100% sativa hybrid.\nTEXT MORPHOLOGY EVIDENCE: strong vegetative growth; dense flowers with relatively little leaf; very large and plentiful trichomes; do not infer plant-wide architecture beyond those text claims.\nPHOTOGRAPHIC CONSTRAINTS: photorealistic botanical reference photography; one mature flowering female cannabis plant; complete plant visible; neutral natural light; neutral non-distracting background; realistic botany; no text; no collage.\nNEGATIVE CONSTRAINTS: no fruit or berries; no people; no labels or logos; no jars, bags, boxes or bottles; no smoke; no unrelated objects; no fantasy anatomy; do not add cultivar-specific morphology beyond the cited official text evidence.",
  "evidenceSnapshot": [
    {
      "description": "[EVIDENCE_ALIGNMENT=NOT_APPLICABLE] Official cultivar imagery is present on the breeder-operated page, but its pixels were not retrievable in this run in a form sufficient for trustworthy visual morphology extraction. No image-derived claims are made; all non-alignment AI visual QA gates remain required.",
      "sourceIds": [
        "ace-seeds-golden-tiger"
      ]
    },
    {
      "description": "Official text morphology evidence: strong vegetative growth; dense flowers with relatively little leaf; very large and plentiful trichomes; do not infer plant-wide architecture beyond those text claims.",
      "sourceIds": [
        "ace-seeds-golden-tiger"
      ]
    }
  ],
  "visualMetadataSnapshot": {
    "alt": "Golden TigerのACE Seeds公式テキスト形態情報を基礎に、未確認の画像由来形態を付加せず作成するAI生成参考ビジュアル",
    "rights": "AI-generated project asset for Cannabis Strain Wisdom. No official or third-party image is copied or stored; prompt uses official text evidence only because visual retrieval was insufficient for image-derived morphology.",
    "scope": "cultivar",
    "aiGenerated": true,
    "sourceType": "aiGenerated"
  },
  "expectedInboxFilename": "golden-tiger.jpg",
  "expectedPrimaryPath": "strains/golden-tiger/images/generated/primary.webp",
  "generatedAt": null,
  "approvalStatus": "pending",
  "approvedAt": null,
  "approvalType": "human-visual-review",
  "approvedManifestRevision": null,
  "approvedAttempt": null,
  "approvedSourceSha256": null,
  "imageInboxCommit": null,
  "imageProcessingCommit": null,
  "processedPrimaryBlobSha": null,
  "processedPrimarySha256": null,
  "width": null,
  "height": null,
  "audit": [
    {
      "severity": "INFO",
      "code": "MANIFEST_CREATED",
      "at": "2026-08-19T13:04:19Z",
      "productionPhase": "IMAGE_PENDING",
      "note": "Created by PRODUCTION START V1. Candidate output is review-only and cannot publish."
    }
  ]
}
