{"schemaVersion":1,"manifestVersion":1,"manifestId":"content-production-20260818T060700Z-01-durban-poison-image","runId":"content-production-20260818T060700Z-01","strainId":"durban-poison","revision":1,"attempt":1,"sourceStockPath":"stock/items/durban-poison.json","sourceStockBlobSha":"8cb7cccdbc5b3e58bb187612335368df10b33103","visualPreparationHash":"3c3fa46a22de1517a730ea6e134a93a521f96626f206c8a985eeec2744478faa","generatedFromManifestVersion":null,"promptSnapshot":"Photorealistic botanical reference image of mature flowering Durban Poison: slim sativa-style plant, numerous side branches bearing long heavy flowers, dense-for-sativa buds with conspicuous resin glands and trichomes, narrow green leaflets, natural neutral light. No labels, logos, packaging, people or smoke.","evidenceSnapshot":[{"description":"Dutch Passion describes a dense and slim sativa-style plant with numerous side branches carrying long heavy flowers, resinous blooms and oversized resin glands.","sourceIds":["dutch-passion-durban-poison"]}],"visualMetadataSnapshot":{"alt":"Durban Poisonの細身のサティバ株、側枝に連なる長く重い樹脂質な花を公式形態情報に基づいて表現したAI生成参考ビジュアル","rights":"AI-generated project asset planned for Cannabis Strain Wisdom; no third-party image will be copied. Visual prompt is derived from cited official morphology evidence.","scope":"cultivar","aiGenerated":true,"sourceType":"aiGenerated"},"expectedInboxFilename":"durban-poison.jpg","expectedPrimaryPath":"strains/durban-poison/images/generated/primary.webp","generatedAt":null,"approvalStatus":"pending","approvedAt":null,"approvalType":null,"approvedManifestRevision":null,"approvedAttempt":null,"approvedSourceSha256":null,"imageInboxCommit":null,"imageProcessingCommit":null,"processedPrimaryBlobSha":null,"processedPrimarySha256":null,"width":null,"height":null,"audit":[{"severity":"INFO","code":"MANIFEST_CREATED","at":"2026-08-18T06:07:00Z","productionPhase":"IMAGE_PENDING","note":"Manifest created from AUTO STOCK visualPreparation; no image generated or approved."}]}
