{
  "schemaVersion": 1,
  "manifestVersion": 1,
  "manifestId": "content-production-start-32255989337-acapulco-gold-image",
  "runId": "content-production-start-32255989337",
  "strainId": "acapulco-gold",
  "revision": 1,
  "attempt": 1,
  "sourceStockPath": "stock/items/acapulco-gold.json",
  "sourceStockBlobSha": "c7db149651a4afcb7a70a4e86fd18629c8fdfd36",
  "visualPreparationHash": "18907833e4a20954c08801d3c1aa43f31b9dedcef3105964f3ce88602362d706",
  "generatedFromManifestVersion": null,
  "promptSnapshot": "TEXT-EVIDENCE FALLBACK: the breeder-operated cultivar page exposes cultivar-specific imagery, but the visual pixels were not retrievable in this run in a form sufficient for trustworthy image-derived morphology extraction. Use only the official text morphology evidence below; evidence alignment is NOT_APPLICABLE.\nCULTIVAR IDENTITY CONTEXT: Acapulco Gold by Barney's Farm; Central American; sativa-dominant regular line.\nTEXT MORPHOLOGY EVIDENCE: medium indoor to taller outdoor plant; thick colas; distinctive reddish-brown calyx/pistil coloration; green-and-gold flower tones; abundant visible resin; do not infer finer architecture not stated in the official text.\nPHOTOGRAPHIC CONSTRAINTS: photorealistic botanical reference photography; one mature flowering female cannabis plant; complete plant visible; neutral natural light; neutral non-distracting background; realistic botany; no text; no collage.\nNEGATIVE CONSTRAINTS: no fruit or berries; no people; no labels or logos; no jars, bags, boxes or bottles; no smoke; no unrelated objects; no fantasy anatomy; do not add cultivar-specific morphology beyond the cited official text evidence.",
  "evidenceSnapshot": [
    {
      "description": "[EVIDENCE_ALIGNMENT=NOT_APPLICABLE] Official cultivar imagery is present on the breeder-operated page, but its pixels were not retrievable in this run in a form sufficient for trustworthy visual morphology extraction. No image-derived claims are made; all non-alignment AI visual QA gates remain required.",
      "sourceIds": [
        "barneys-farm-acapulco-gold"
      ]
    },
    {
      "description": "Official text morphology evidence: medium indoor to taller outdoor plant; thick colas; distinctive reddish-brown calyx/pistil coloration; green-and-gold flower tones; abundant visible resin; do not infer finer architecture not stated in the official text.",
      "sourceIds": [
        "barneys-farm-acapulco-gold"
      ]
    }
  ],
  "visualMetadataSnapshot": {
    "alt": "Acapulco GoldのBarney's Farm公式テキスト形態情報を基礎に、未確認の画像由来形態を付加せず作成するAI生成参考ビジュアル",
    "rights": "AI-generated project asset for Cannabis Strain Wisdom. No official or third-party image is copied or stored; prompt uses official text evidence only because visual retrieval was insufficient for image-derived morphology.",
    "scope": "cultivar",
    "aiGenerated": true,
    "sourceType": "aiGenerated"
  },
  "expectedInboxFilename": "acapulco-gold.jpg",
  "expectedPrimaryPath": "strains/acapulco-gold/images/generated/primary.webp",
  "generatedAt": null,
  "approvalStatus": "pending",
  "approvedAt": null,
  "approvalType": "human-visual-review",
  "approvedManifestRevision": null,
  "approvedAttempt": null,
  "approvedSourceSha256": null,
  "imageInboxCommit": null,
  "imageProcessingCommit": null,
  "processedPrimaryBlobSha": null,
  "processedPrimarySha256": null,
  "width": null,
  "height": null,
  "audit": [
    {
      "severity": "INFO",
      "code": "MANIFEST_CREATED",
      "at": "2026-08-19T13:04:19Z",
      "productionPhase": "IMAGE_PENDING",
      "note": "Created by PRODUCTION START V1. Candidate output is review-only and cannot publish."
    }
  ]
}
