{
  "schemaVersion": 1,
  "manifestVersion": 1,
  "manifestId": "content-production-start-32255989337-mazar-image",
  "runId": "content-production-start-32255989337",
  "strainId": "mazar",
  "revision": 1,
  "attempt": 1,
  "sourceStockPath": "stock/items/mazar.json",
  "sourceStockBlobSha": "b636019893cfa14973f85d7c4aef8f07b9ff2044",
  "visualPreparationHash": "c21a4b7cee4ef76a720cf5e2ddc38e429eedb231c1418a96ed7236714395ca47",
  "generatedFromManifestVersion": null,
  "promptSnapshot": "TEXT-EVIDENCE FALLBACK: the breeder-operated cultivar page exposes cultivar-specific imagery, but the visual pixels were not retrievable in this run in a form sufficient for trustworthy image-derived morphology extraction. Use only the official text morphology evidence below; evidence alignment is NOT_APPLICABLE.\nCULTIVAR IDENTITY CONTEXT: Mazar by Dutch Passion; Skunk #1 × Afghani; indica-dominant hybrid.\nTEXT MORPHOLOGY EVIDENCE: medium-sized and compact indica-dominant plant; thick sturdy branches; short-to-medium internodes; broad dark-green indica leaves; large dense heavy flowers with a thick sticky trichome layer and orange hairs.\nPHOTOGRAPHIC CONSTRAINTS: photorealistic botanical reference photography; one mature flowering female cannabis plant; complete plant visible; neutral natural light; neutral non-distracting background; realistic botany; no text; no collage.\nNEGATIVE CONSTRAINTS: no fruit or berries; no people; no labels or logos; no jars, bags, boxes or bottles; no smoke; no unrelated objects; no fantasy anatomy; do not add cultivar-specific morphology beyond the cited official text evidence.",
  "evidenceSnapshot": [
    {
      "description": "[EVIDENCE_ALIGNMENT=NOT_APPLICABLE] Official cultivar imagery is present on the breeder-operated page, but its pixels were not retrievable in this run in a form sufficient for trustworthy visual morphology extraction. No image-derived claims are made; all non-alignment AI visual QA gates remain required.",
      "sourceIds": [
        "dutch-passion-mazar"
      ]
    },
    {
      "description": "Official text morphology evidence: medium-sized and compact indica-dominant plant; thick sturdy branches; short-to-medium internodes; broad dark-green indica leaves; large dense heavy flowers with a thick sticky trichome layer and orange hairs.",
      "sourceIds": [
        "dutch-passion-mazar"
      ]
    }
  ],
  "visualMetadataSnapshot": {
    "alt": "MazarのDutch Passion公式テキスト形態情報を基礎に、未確認の画像由来形態を付加せず作成するAI生成参考ビジュアル",
    "rights": "AI-generated project asset for Cannabis Strain Wisdom. No official or third-party image is copied or stored; prompt uses official text evidence only because visual retrieval was insufficient for image-derived morphology.",
    "scope": "cultivar",
    "aiGenerated": true,
    "sourceType": "aiGenerated"
  },
  "expectedInboxFilename": "mazar.jpg",
  "expectedPrimaryPath": "strains/mazar/images/generated/primary.webp",
  "generatedAt": null,
  "approvalStatus": "pending",
  "approvedAt": null,
  "approvalType": "human-visual-review",
  "approvedManifestRevision": null,
  "approvedAttempt": null,
  "approvedSourceSha256": null,
  "imageInboxCommit": null,
  "imageProcessingCommit": null,
  "processedPrimaryBlobSha": null,
  "processedPrimarySha256": null,
  "width": null,
  "height": null,
  "audit": [
    {
      "severity": "INFO",
      "code": "MANIFEST_CREATED",
      "at": "2026-08-19T13:04:19Z",
      "productionPhase": "IMAGE_PENDING",
      "note": "Created by PRODUCTION START V1. Candidate output is review-only and cannot publish."
    }
  ]
}
